{
  "$schema": "../schemas/pack.schema.json",
  "name": "pack.browser.local",
  "version": "0.1.0",
  "capabilities": [
    "pack.browser.local@0.1.0"
  ],
  "verifiers": [
    "pack.browser.text"
  ],
  "policies": [
    "local_write",
    "loopback-only browser targets"
  ],
  "fixtures": [
    "test/browser.test.ts"
  ]
}
