{
  "$schema": "../schemas/pack.schema.json",
  "name": "pack.transform.json",
  "version": "0.1.0",
  "capabilities": [
    "pack.transform.json@0.1.0"
  ],
  "verifiers": [
    "pack.transform.json"
  ],
  "policies": [
    "local_write"
  ],
  "fixtures": [
    "lab/fixtures/data-transform-pack.json",
    "test/data-transform.test.ts"
  ]
}
